text_a	text_b	score
晒太阳的人们。	正多边形的外接圆。	0.0
干一行爱一行。	清代毕沅有吕氏春秋新校正，另外还有刘咸炘〈吕氏春秋〉发微、〈吕氏春秋〉疏、宋慈袌〈吕氏春秋〉补正、刘文典〈吕氏春秋〉斠补、孙人和〈吕氏春秋〉举正、谭戒甫吕子辑校补正等。	0.0
有一种爱叫放手。	但是从1864年开始，这个词语开始被用作一种荣耀的象征。	0.0
明智的人知道什么时候该糊涂。	现代人平均智商在逐渐增加，被称为弗林效应，但不了解其原因是智力实际增长还是因为测量的原因所导致。	0.0
老实说我手头没有那本书。	据阿喇多罗陀罗尼阿噜力品载，观世音、大势至二菩萨俱呈纯金色白焰光，右手执白拂，左手执莲花，大势至菩萨之形体略比观世音菩萨小。	0.0
句句都说到了我的心窝里。	贵霜王朝。	0.0
我怀疑他会来。	直到1944年5月30日，无畏号才完成维修。	0.0
今天周末，他未必在家。	在退休还乡后，在家乡兴办教育事业。	0.0
好不容易。	臀鳍硬棘3枚，软条8枚。	0.0
天气暖和多了。	俄克拉何马包括的印地安保留地曾经试图以Sequoyah州的名义单独加盟。	0.0
有人由于不讲逻辑，因此对别人不合逻辑的言论，不但不能觉察它的荒谬，反而随声附和，人云亦云。	由于其分布局限，马来王猪笼草已被世界自然保护联盟评估为濒危物种，列于濒危野生动植物种国际贸易公约附录一中。	0.0
学校里调来了一位女教师。	该歌曲由希腊歌剧作曲家萨马拉斯作曲、希腊作家兼诗人帕拉马斯作词，但当时仍未被确定为奥林匹克会歌；	0.0
你喝了不到两盅酒，就叨叨叨，叨叨叨，你有个够没有？	温布尔登现象原本是指在英国举办的温布尔登网球锦标赛（Wimbledon Championships）中，从1936年弗雷德·佩里（Frederick John Perry）夺冠后，长年没有英国选手得奖，直到2013年安迪·穆雷（Andy Murray）获得冠军，才终结了地主国的冠军荒。	0.0
对！首先让我向大家做个自我介绍吧。	然而，耶和华却重申他的拯救应许，并再三强调要使他的名成圣，说：我是耶和华。	0.0
通货膨胀是一种货币现象，过量的货币追逐有限的商品。	通货膨胀是一种货币现象，也就是说过量的货币追逐有限的商品。	1.0
科学家正在努力探索这一奥秘，以便根据它的原理来研制新的导航仪器。	主持节目。	0.0
我一定把驾驶执照考下来，只要你给我时间。	只要你给我时间，我便一定把驾驶执照考下来。	1.0
这两天闷的慌。	帝曰：岁丰，人不乏食，朝得贤辅佐，军中有十万铁骑，乃可为瑞，此外不足信。	0.0
老范的心里乱极了。	卢吉道西接夏力道、克顿道及漆咸径交界，东端路口接柯士甸山道、夏力道、山顶道、旧山顶道及芬梨道交界，见凌霄阁。	0.0
不一会儿他又回来了。	因为身材肥胖而受到欺凌的学生'，过著一边逃避现实，一边躲在校内网路一角提升自己虚拟壁球游戏的分数最高纪录的日子。	0.0
还欠三万块钱没有还。	在太平洋战场上的塞班岛战役、硫磺岛战役和冲绳岛战役里，日军基本上没有正面火力可直接和雪曼系列对抗，要击毁M4系列战车通常得依靠隐蔽良好的反战车炮近距离击杀甚至是人肉特攻才能对其有效，另一种日军采用的反坦克武器是磁铁炸药，美国海军陆战队为此要在M4A2的车身加装木板。	0.0
只有做了广泛深入的调查研究，才可能得出让人们信服的结论。	阿恩海姆认为知觉结构是一种特殊的力的结构，也是一种对力的感受结构，审美体验即是一种对力的体验，人们在知觉某种特定的形象时所感知到的力，它具有扩张和收缩，冲突和一致。	0.0
把纸撕了。	康德在理性主义薰陶下成长，他深深地被休谟的经验论所扰乱。	0.0
我们不一定去问他。	我们不用非得问他。	1.0
毕业后，要么读研，要么出国留学。	温热经纬一书，集温病学之大成，溯本求源，纲举目张，汇编温病文献，被认为是习温病学的入门必读之作。	0.0
这间房子将能容纳十个人。	张其昀也是中国第一位研究现代国家战略学（方略学）的学者。	0.0
难道你有钱没地方花吗？	唐朝的地方官若要立碑纪功，要由皇帝下旨诏敕。	0.0
处处我都检查过了。	每处我都检查过了。	1.0
把犯人跑了。	犯人跑了。	1.0
这本书不是我的。	虽然他们都无法把握安心，但他们却心甘情愿地为她前赴后继，安心也许真的不是故意的，但内心对于激情的渴望却让3个爱她的男人的命运变得无法掌控。	0.0
她把这批马调教的很好。	因经济上欠佳，以变卖家产维持，有时替白俄罗斯老师代笔在法国总会画壁画挣几块大洋贴补，最后一学期因经济辍学，校方依然赠给毕业文凭。	0.0
这次活动与其说是在培养孩子们吃苦精神，还不如说是给他们一次体验集体生活的机会。	他们开价$240去帮助他。	0.0
他毕竟是一个孩子。	隧道和狗都通过一个怪诞的故事，表现了一种人被它物所控制，茫然无力，不知前途为何的社会心理。	0.0
看的书都放在桌子上。	上述记载见于宋史、续资治通鉴长编、涑水记闻等史书及笔记中，皆言赵匡胤是为众所逼，被迫称帝，事前并不知情。	0.0
如果是一个贪图财物享受的人，他就不会天天把自己关在书斋里做学问了。	如果客人进来的数目符合泊松过程，且服务时间是指数分布，则可用M/M/1模拟，并算出平均队列长度、不同等候时间的机率等。	0.0
大勇整天躺在床上看杂志、听音乐，借以打发这茫然无聊的日子。	不过，如果闭弦快子处于奇点周围，它将会把奇点给消解掉。	0.0
我不能不去北京。	姚安地震发生于北京时间2009年7月9日19时19分。	0.0
我们在哪些地方做的不对，或者不够令人满意？	哪些地方我们做的不对？	0.8
他有的是书。	他有很多书。	1.0
通过宏观调控，既保持了经济快速发展的良好势头，又纠正了经济增长过程中的不健康因素。	同年4月24日，方案得到国务院批复通过，5月进入五大公司（集团）脱钩移交阶段。	0.0
他没拒绝我的要求。	在当时，换装一支F-104中队需要的经费，与换装三个人数破万的陆军师相等，在经费拮据战略仍需反攻大陆的时代，分配资源的比重不只考虑实质战术要求，也涉及政治智慧的配重；	0.0
你什么时候也信起这一套了？	你信这一套吗？	1.0
他们吃喝完了所有的家产。	现在英国下议院的坐席划分为执政党与反对党两边，各自有一条红线，两条红线相距为两把剑的长度，两方都不可以越过红界，这意味是将议员分隔，不许他们决斗，因为英格兰的早期议会是容许持武器进场的。	0.0
由于对造成事故的主观原因认识不足，因此导致了此类事故的再次发生。	但另一方面，由于济州语保存了不少古语，亦缺少了敬语，无形中为数不少已融入标准韩语的汉语词亦不存在于济州语，例如：食事、安宁等。	0.0
他的瘤子还不太大。	主要分布于韩国、中国大陆、台湾，常栖息在浅海沙底。	0.0
这一次，投资者仅仅是“有望收回成本”，换句话说，很可能赔本！	这一次，投资者仅仅是“有望收回成本”，即很可能赔本！	1.0
我休礼拜出去玩儿，没留神让老虎给吃了。	区内除一般公共小巴及巴士路线外，还有在1988年落成的轻铁连接区内及元朗。	0.0
地震与海啸令这个国家的经济又倒退了十年。	工作涉及的国家。	0.0
老李大概现在正在看报呢。	在主要的建模软件中，细分曲面建模现在比非均匀有理B样条（NURBS）建模更为流行。	0.0
他们系走了一个老师。	在测量3n、4n和5n中子蒸发激发函数时，他们探测到3个Fl原子、12个Fl原子及1个新同位素Fl原子。	0.0
他怀疑事情还没有办完。	假装怀孕但是却没有一般孕妇该有的症状，最后被威尔识破。	0.0
为人民服务！	圣秩圣事和婚姻圣事—是为其他人的得救而设立的，通过其为他人服务而达成的。	0.0
我休礼拜出去玩儿，没留神让老虎给吃了。	家庭婚姻。	0.0
昨天监狱里跑了一个犯人。	昨天一个犯人从监狱里跑了。	1.0
她吃坏了肚子。	帝尧听说舜非常孝顺，有处理政事的才干，把两个女儿娥皇和女英嫁给他；	0.0
狐狸心里想，我先说些好话哄哄你，让你放松警惕；狐狸心里又想，等你放松警惕后，我在想办法把你嘴里的肉弄到手。	红鲑全长可达84公分（33英吋），重达2。	0.0
那么好的人你怎么看不上他。	他那么好的人你怎么看不上。	1.0
好好学习汉语。	汉语要好好学习。	0.8
办了三次，三次都没有成。	伊丽莎白女王一向认为，过早地确定继承人会削弱自己的地位，而且这一举动也会给她的政敌以可乘之机，因为他们可以利用这个继承人来反对她，没有继承人的英格兰就不会在她没有驾崩的情况下陷入内战。	0.0
切菜都不会，可见你不会做饭。	而在之后数次的反复引退与复出后，藤圭子慢慢失去歌迷喜爱。	0.0
躺在床上翻来覆去，睡不着。	总统李登辉于1995年的康乃尔大学之行首次提出中华民国在台湾（the Republic of China on Taiwan）的用语，以地理的角度诠释国家定位。	0.0
老张家的房子厨房不大。	其工程包括重建回力娱乐场、澳门八佰伴旧址、回力停车场及毗连空地、皇宫娱乐场及毗连水域拟填海地段，整个项目预算投资超过六十二亿元(未含地价)，地盘面积逾四万六千五百平方米，建筑面积约三十二万五千平方米，为澳门博彩股份有限公司预算投资最庞大工程，将为游客及居民提供酒店、商住、购物、娱乐、消闲一站式服务，预计2007年动工，2009年起分阶段落成，项目划分为三部分。	0.0
在挪威屠杀惨案中，85人被害。	西汉末期，由于局部海侵，海平面在天津附近上升了大约1米，当时海岸在今天的军粮城一带。	0.0
这部电影值得一看。	这部电影可以看一看。	1.0
什么她都爱买。	目前，重庆钢铁集团公司生产能力为生铁600万吨、钢650万吨、钢材600万吨。	0.0
她把每间屋子都打扫了一遍。	高雄捷运以地下路线为主，红线的桥头火车站到世运站间为高架段；	0.0
我从小王那儿借了两本小说。	总的趋势是由南向北递减。	0.0
小心别碰着油漆。	因国府坚持11月中召开制宪国民大会，而周恩来称，国民大会一旦召开，他就回延安。	0.0
他讲了至多十分钟。	凌霄阁低层设美心旗下的美心香港地茶餐厅、地下设Pacific Coffee及Jungle Juice果汁饮品店；	0.0
因为时间太仓促了，他们放弃了这次参赛的机会。	许思行曾经为TVB演唱多首美少女战士的主题曲及片尾曲，更凭不必放弃夺得1998年度儿歌金曲颁奖典礼至Net儿歌大奖。	0.0
我们还没有拥有技术转让的权力。	法轮功没有辟谷和不休息的现象。	0.0
她没有半点私心。	当初计划推行3部作，并没有开发α外传的打算。	0.0
只要她一去接电话，孩子就会大哭大闹。	一旦她去接电话，孩子便会大哭大闹。	1.0
忙的没个空儿。	曼彻斯特联。	0.0
这件事情她亲爸也没办法。	如果犯人在审讯中发现比雷尼·斯默聪明，那么他就得负刑。	0.0
你不觉得我们的战士很可爱吗？	由于阳原王的支持者夺得军权，所以才能继位。	0.0
柜子叫小弟给翻得乱七八糟。	在4，735居民中，有32。	0.0
没你这么干的。	你这么干是与所有人背道而驰的。	1.0
你穿太少了，当心着凉。	你穿不少，不用当心着凉。	0.0
尽管他赢得了冠军，可是没有赢得人们的尊重。	他为这个发明注册了全球专利，但是在1988年，因为没有足够的钱给专利延期，专利进入了公有领域。	0.0
他连个规矩都没有。	因落发出家当天便去世，因此没有院号，以妍子最后所居的枇杷殿为号，后世称枇杷太后。	0.0
倘或他有个好和歹。	倘若他有个好歹。	1.0
差点儿答不上来。	差点儿答不上来。	1.0
没你这么不讲道理的。	你太不讲道理。	1.0
他破了个例。	乾隆十年（1745年）励宗万写的京城古迹考记载，天宁寺惟留古殿一间，殿中立无量寿佛一尊。	0.0
我们不欢迎撒谎的人。	我不喜欢撒谎的人。	1.0
因爱而恨。	后又两次出使藩国，拒绝馈赠。	0.0
我们有能力打进决赛。	转移问题。	0.0
树旱死了。	府直属县：武陵县、桃源县、龙阳县、沅江县	0.0
我习惯喝咖啡不放糖。	祯子内亲王，第67代天皇—三条天皇之女三宫，生母为中宫藤原妍子，之后成为69代后朱雀天皇之皇后，生有良子内亲王、娟子内亲王、尊仁亲王等2女1子。	0.0
姐姐比我聪明多了。	随著时间的推移，牙龈疾病会使牙龈顺牙齿向上萎缩。	0.0
不是每家都买了汽车。	国际米兰（1997～	0.0
她吃坏了肚子。	她把肚子吃坏了。	1.0
兵兵回宿舍睡觉了。	秦始皇（英语：The First Emperor）是一部以中国第一位皇帝秦始皇为原型的英语悲歌剧。	0.0
树旱死了。	八届十一中全会上，刘少奇在党内的地位由第二降至第八，林彪则由第六升至第二。	0.0
静静地坐着。	这样的发现是源于如下的研究：在严重癫痫患者的大脑里面植入电极，当作是患者在手术过程中诊断的方式。	0.0
不是每家都买了汽车。	不是每家都有汽车。	1.0
总务处长邀请各年级学生代表就学校的伙食问题与管理部门进行对话。	然而，对灿的事情十分在意的濑户内组也追上灿与永澄，强硬地成为了永澄就读的学校的教师，监视著二人（时而是莲与政对豪三郎们的暴走谏戒或参与）。	0.0
就算前面是地雷阵，我也要一往直前。	即使前面是地雷阵，我也要一往直前。	1.0
信上说的清楚。	直至约公元15、16世纪，0才逐渐给西方人所认同，使西方数学有快速发展。	0.0
这个公园逛了我们一个下午。	两个高原构成其余30%的表面地区，一个在行星的北半球，另一个正好在赤道的南边。	0.0
逗得我们哈哈大笑。	由于区内适龄学童愈来愈少，不少学校都面临杀校问题，这由其以村校为甚。	0.0
我借给了小王两本小说。	我的两本书借给小王了。	1.0
不管荤的、素的都没个完。	列女传是汉代的名儒家学者刘向所写。	0.0
看什么电视，还不赶快做功课去！	租赁使用时段，或称租赁频道（leased access），是美国联邦通讯委员会（FCC）制定出一项由有线电视业者提供给独立的有线电视节目与制作人使用的电视时段或频道。	0.0
别把愁事憋在心里。	电视动画 数码宝贝合体战争第一至三期相继展开。	0.0
来的人很多，会场一会儿就坐满了。	掌管祭祀仪礼。	0.0
不管我们如何好说歹说，他却仍然是无动于衷。	，刘涣遂免罪。	0.0
在挪威屠杀惨案中，85人被害。	后来起火点普丁巷附近立了一个纪念碑，高61。	0.0
谁也不知道事情的真相。	他或者从Google找到一篇维基条目，看到它是一部宣称是『百科全书』的东西的一部份，而这个词蕴含了可靠的意思，可是除了传统百科全书自己以外，一般用者根本不知道传统百科全书是如何达致可靠性的。	0.0
这幅画花了我一个多月。	田中在同年十一月宣布辞职。	0.0
明天下雨的话，活动就会泡汤。	明天下雨的话，活动便会泡汤。	1.0
他们都在说笑小王。	自2006年10月1日起，除了一直是无烟区的餐厅外，德国铁路列车内的小酒馆区域也被划为无烟区。	0.0
还了他五十块钱。	她在Seventeen杂志出现。	0.0
我们在哪些地方做的不对，或者不够令人满意？	哪些地方我们做的不够令人满意？	0.8
一个人难免犯错误。	一个项目代号通常是单字、短语或首字母缩写）是工业、学术界、政府部门开发的一个项目名称。	0.0
为这件事，我们都很高兴。	大多数外国企业集中在波哥大，有些在这里有垄断地位。	0.0
办了三次，三次都没有成。	三次都没有办成。	1.0
他的身体不如从前硬朗了。	一文，刊登在1933年自由言论杂志一卷六期上，文章称： 先剿匪，后抗日，这是两年来政府坚决不变的政策。	0.0
一个人难免犯错误。	人不犯错误是不可能的。	1.0
这人一面对我言听计从，一面却又在背后搞小动作。	这人表面对我言听计从，背后却又搞小动作。	1.0
通过翻译，我们交谈了半个小时。	与互动新闻台相比，TVB新闻台虽然会现场直播重要记者会及演讲（该频道节目基本与互动新闻台同步，以照顾香港部分地区无法接收数码广播的观众），但由于要兼顾播放其他新闻，因此无法全程直播，只能播放起初的一小段。	0.0
你不是一个俗人。	门图荷太普二世死后，被埋在一个大的墓室里，这个墓室是他在生时指令在戴尔巴哈里（Deir el-Bahri）兴建的。	0.0
把纸撕碎。	纸被撕碎。	1.0
你要好好休息啊。	联盟赛普拉斯公司铁路以东西向通过南墨尔本	0.0
他说破了嘴。	日本以作为邻国互相协助、反省过去的过错等理由来援助中国发展，1978年中华人民共和国与日本两国代表签署中日和平友好条约。	0.0
小王看完了书。	书被小王看完了。	1.0
事情他已经去办了，成不成还不知道。	承恩寺记略	0.0
当我回家的时候，他们已经睡着了。	他们睡着以后，我才回到家。	1.0
这部电影值得一看。	因而它们大小相同。	0.0
这问题让人说滥了。	然而，此时的游戏版本仍然面临著许多技术性问题。	0.0
这是我看书的桌子。	文翠珊竞逐党魁时的第三轮投票唯一对手利雅华其后退选，使文翠珊在7月11日自动成为党魁。	0.0
静静地坐着。	我便派军法官及有关人员前往查办，并掘坟检视，情形确实，惨不忍睹。	0.0
她上次来姥姥家过暑假的时候，还是个小学生呢。	从宗教改革的时候到今天，天主教会一直是被讽刺和幽默的目标。	0.0
这个难题被技术部门及时攻克。	这个网站也报道了2006年美国中期选举的情况。	0.0
它所有的丫枝一律向上，而且紧紧靠拢，也像加过人工似的，成为一束，绝不旁逸斜出。	它所有的丫枝一律向上，紧紧靠拢，也像加过人工似的，成为一束，绝不旁逸斜出。	1.0
既然困难这么多，就不必在这件事上浪费时间了。	北侧以武进路为界，毗邻四川北路街道；	0.0
他逃脱不了法律的制裁，尽管他爸爸是李刚。	学者张箭认为，郑和下西洋并没有太大的经济需求，他的七次大规模航海不仅没有为明朝带来巨大的利润，反而令国库空虚。	0.0
我知道他不了解情况。	要与绑架大小姐的绑匪谈判、这份工作对他来说是份轻而易举的工作，但等到他真正做到后，才发现情况有所异常。	0.0
这件事非你去不成。	另见名古屋站。	0.0
老雷一个字也没有透漏。	狄奥多拉是一个意志坚强的女子，她在统治过程中显示出了她的才干。	0.0
我让她坐进我的三七炮位里，给她扣上我那沉重的钢盔，告诉她这炮火力相当猛烈。	行政局首席议员一职成功过渡到1997年香港回归之后，职称亦从此改为行政会议召集人；	0.0
我之所以会吃惊，是因为没想到会在这种地方遇见他。	由于节目均属特技效果，节目播出之前，均会播出一段警语，请观众不可模仿，以免造成重大伤害。	0.0
阳春四月，平原地区的桃花早就凋谢了，可是这里却仍然是一片绯红，桃花含苞欲放，艳丽多姿。	现时仍然效力的比得·侯顿（Peter Hutton）保持德利城在爱尔兰足球联赛（League of Ireland）最多上阵的纪录，自1990/91年球季加盟以来曾两度离队再回归，直到2008年4月已达到600场 ；	0.0
她的认真感动了我们。	而世界女童军总会也成立了4个国际中心：墨西哥的我们的卡巴尼亚、瑞士的我们的雪丽、伦敦的和平之屋和印度的桑冈。	0.0
噢，我来这儿搞个采访。	太古股份公司在香港注册，董事会主席为史乐山。	0.0
这件事情她亲爸也没办法。	这件事她亲爸也解决不了。	1.0
没你这么不讲道理的。	此后朝鲜对台湾东宁国漂来船舶改变办法，不准其登陆，就地遣返，以避免再次发生此类悲剧。	0.0
老李看样子不会来了。	立法会议员个人提出的议案、法案和对政府法案的修正案，须分别经地方直选议员及功能界别议员各过半数通过。	0.0
哪怕全家反对，我也要去当兵。	所有阵营的迫击炮都配有落地高爆弹，而正规军及车臣反叛军（MILITIA）阵营还配有专用于杀伤人员的空爆弹和用于干扰战场的烟雾弹。	0.0
我没打过老婆。	我打过老婆。	0.0
为这件事，我们都很高兴。	马丁·路德翻译新约时所居住的房间也按照当年的样子得到复原。	0.0
我们没有不同意。	由于男主角（日和见日郎）要到姐姐（日和见纱和和）工作的地方居住，但到达后发现姐姐信中的地图作指的是山上的废屋，发现没有人居住的迹像后，便到山下的小镇寻找姐姐（日和见纱和和），在途中，建筑工地的吊塔吊著工字铁的吊勾突然松脱，主角（日和见日郎）为了救正要被工字铁压到的少女而舍弃了自己的生命，没想到少女正是山顶洋房的主人，而金发少女的父亲是立于所有怪物之上的王。	0.0
看的很清楚。	曾任推事、律师、宪法起草委员会和资源委员会专员、代理最高检察长等职；	0.0
他没有吃饱。	卡塞迪与瓦力也没有说到是否GEMTC的模型论包含到任何传统的拓扑空间。	0.0
缺不了你的钱花。	场地赛在8月20日－25日在雅典奥林匹克体育中心的the Olympic Velodrome进行，山地赛在8月27日—28日在帕尼萨山地自行车场举办。	0.0
这台电脑修了我五百块钱。	员工待遇及工业行动。	0.0
因为做过多年的幼儿园老师，所以她深知这些孩子此时最需要什么。	（因为Shoham 这个社区，当时才刚遭逢有两个孩童被谋杀的事件）。	0.0
他下楼了，在门口买了几个面包，塞在书包里，然后去了图书馆。	他下楼了，在门口买了几个面包，把面包塞在书包里，最后去了图书馆。	1.0
他是见过大世面的人。	透过第5章登记。	0.0
不成也值。	就算不成也值。	1.0
这张书桌不长。	老父来京未见，痛极！	0.0
奶奶告诉我一个天大的秘密。	选取、剪下缓冲区和拖曳机制在 X Window 系统中，是给使用者从某个视窗传递资料给另一个视窗。	0.0
他有的是书。	想见到海啸、地震的发生：2013年10月，成龙在美国加州为电影十二生肖宣传时接受美联社访问，表示有时我真想见到有些国家遭遇灾难，好像是大海啸、好像是大地震，在发生大灾难时，你会见到地球上每个人都飞到那国家帮忙。	0.0
我国在这一方面的法律规定与贵国的法律规定相同。	我国的法律规定与贵国的法律规定在这一方面相同。	1.0
我修电脑修了五百块钱。	五百块钱被我拿来修电脑了。	1.0
我们仍然没有收到回信。	虽然她的血统没有被直接提及，但是她的父母都是巫师。	0.0
小猪让老虎叼走了。	从25日起，工人又破坏了部分线路和桥梁。	0.0
每个人都有属于自己的一条路，或者平坦，或者艰险，或者漫长，或者短暂；每个人的爱情经历都是值得回味的，或者甜蜜，或者苦涩，或者如愿，或者遗憾······。	后来，Lori和Edgemar博士，一个来自Rekall公司的人，来找Quaid，试图说服他其实到此为止，他的所有经历都是Rekall公司带来的虚拟经历，想要醒过来，他必须服下一粒胶囊，或者接受脑白质切除术。	0.0
把纸撕碎。	钴(II)与氨的配合物在氧气存在下，很容易被氧化成钴(III)的配合物：	0.0
通过宏观调控，既保持了经济快速发展的良好势头，又纠正了经济增长过程中的不健康因素。	通过宏观调控，保持了经济快速发展的良好势头，纠正了经济增长过程中的不健康因素。	1.0
不一会儿他又回来了。	但是，1846年公布的新法律设立了郡法院，在当事人提出要求的情况下，也仅限于超过5点以上的案件适用陪审审理。	0.0
他是才来的，岂有个为他疏你的。	而大量移民形成埋冤之地，却发生在清领初期，所以台湾通史的说法并不正确。	0.0
