text_a	text_b	score
他逃脱不了法律的制裁，尽管他爸爸是李刚。	他逃脱不了法律的制裁，虽然他爸爸是李刚。	1.0
老王嫁了他一个女儿。	从外观上看它是一座两层的建筑，实际在两层之上还有一个暗层。	0.0
老雷一个字也没有透漏。	突击（Assault）模式专用武器，跟UT99功能一样，而且也没有闪电枪（Lightning Gun）发射时会暴露踪迹的缺点，但是发射之后会产生大量浓雾。	0.0
小王被领导批评的时候，他还在笑呢。	领导批评了正在笑的小王。	1.0
下课后，大伙有的在踢毽子，有的在打乒乓球，还有的在跑步，都在积极的锻炼身体。	由于德国及义大利占领维琪法国及未能成功控制在土伦的法国舰队（淡紫色行动），法国非洲军团占在盟军一方作战，提供3个军给安德森，还有法军战舰如黎赛留号战列舰亦加入盟军作战。	0.0
他吃烤鸭吃胖了。	一般的密度扰动是两者的混合，不同的理论希望去解释一阶密度扰动能谱，预测不同的混合方式。	0.0
忘锁门了，我！	军事政变。	0.0
小明向妈妈笑了笑。	各国也可以向国际组织派遣外交代表，如驻欧盟大使、驻联合国大使等。	0.0
他没往家里寄过半分钱。	而这新正统神学则是对传统更正教正统神学与自由派神学彻底失望，同时强烈反对基要派对圣经的看法，所兴起的一个神学，他们单纯的希望重拾神话语的神学。	0.0
他一下班就走了。	中国－苏丹关系是中国和苏丹之间的外交关系。	0.0
他逃脱不了法律的制裁，尽管他爸爸是李刚。	上课时必打瞌睡，因此常遭老师责骂。	0.0
站着别动！	不仅史丹利去找布兰奇兴师问罪，米奇也怀疑为何每次他们约会布兰奇总是希望约在晚上或黑暗的地方，而他总是看不到她的脸。	0.0
买来的面包将够数。	詹金斯虽然是热门候选人，但最后在第一轮选举却屈居第三名。	0.0
他在我洗澡的时候把电视机修好了。	当时袁术派遣孙坚驻屯于阳城以拒董卓，袁绍派周昂夺取孙坚驻守之处，袁术便派公孙瓒从弟公孙越与孙坚一同攻打周昂，没有获胜，公孙越为流矢所中死。	0.0
老雷一个字也没有透漏。	三瘤齿兽没有犬齿，门齿与犬齿后齿之间有个缺口。	0.0
他不高兴地说。	邻居们会把痰吐在他面前的地上，流露出鄙夷不屑的神情。	0.0
不几天事情就办完了。	宋仁宗庆历二年（1042年），李元昊谋臣张元向景宗皇帝献计。	0.0
我给了她一只笔。	它们并不像其他Unix系统，而是选择内建图形用户界面。	0.0
小明在家务上给妈妈帮了不少忙。	翌年，王曼丽在九运会中赢得速度滑冰女子全能小项的金牌，并在世界赛中的总得分取得第8位。	0.0
他被批评了一顿。	他挨批了。	0.6
他修好了电脑。	在希腊化时期之后，希腊文取代了埃及文成为埃及学者使用的语言。	0.0
他们家跑了一条狗。	同年被选为中华青年联合会常委。	0.0
坐在台下的母亲发现，女儿小兰的眼中闪动着泪光。	女儿小兰的眼中闪动着泪光被坐在台下的母亲发现了。	1.0
小红帽没有被狼外婆吃掉。	狼外婆没有把小红帽吃掉。	1.0
再给你我拿瓶啤酒！	一开始德国电视二台仅使用地面站在西德境内播送。	0.0
因为这件事，小田受到了表扬。	小田因为这件事受到了表扬。	1.0
小明替妈妈做饭。	这种果蝇的成虫破蛹行为有着明显的近昼夜节律，接近24小时。	0.0
我们没有不同意。	但是由于消息传递的不确定性，可能会没有任何learner获得了决议批准的消息。	0.0
没关系，多双筷子罢了。	大众文化。	0.0
从这里走比较近。	"近年来学校体育部门会将比赛移至纽约市进行，并积极推广""New York's College Team""之宣传口号。"	0.0
柱子让汽车给撞倒啦！	一方面，郭伯伟反对对市场进行任何资助或补贴，因此他不支持对本地工业进行补贴，也没有应要求向兴建中的红磡海底隧道提供资助。	0.0
你是来帮忙的，还是来起哄的？	随后唯一的萨摩藩浪士有村次左卫门成功击倒轿旁的护卫，一把将井伊直弼由轿中拖出斩首，与广冈子之次郎一同带著井伊的首级突围，但先后被砍成重伤，最后朝向日比谷门方向逃逸。	0.0
累得她气都喘不上来。	弗罗伦斯·南丁格尔	0.0
他的病好不了。	它被用于证明关于序数的很多其他有用的结果。	0.0
我去年到过泰国。	下层面阔九间，进深三间，明间设有双扇板门，左右各三间安有一码三箭式直棂窗，两梢间、山墙以及后檐使用砖墙封护。	0.0
请大家安静一点。	康科德以盛产花岗岩著名，全国许多重要建筑都采用这里出产的花岗岩，如州议会大厦、首都的国会图书馆等。	0.0
他不见得就弄懂了。	国际台的重新定位也是为了减低采购节目的成本，和吸引高收入及高教育水平之观众。	0.0
小明跟爸爸一起去看电影。	香港国艺娱乐重点栽培艺人，在台湾的经纪约则签给电影叶问、叶问前传台湾发行公司华映娱乐。	0.0
老太太的情绪不稳定。	其识别象征物为郁金香妖精。	0.0
因为这件事，小田受到了表扬。	卡梅隆对找施瓦辛格来演瑞斯有些疑虑，因为他觉得自己会需要找位个头更大的家伙来扮演终结者。	0.0
闹绯闻也成了名。	此层设有礼宾部为客人提供优质客户服务。	0.0
这道题好容易啊，不到五分钟我就做出来了。	绒缨菊（学名：）为菊科一点红属的植物。	0.0
中国不首先使用核武器，不管是面临核威胁或者是面临核讹诈。	曾随团到中国（北京、广州、珠海、上海、杭州、宁波、厦门、哈尔滨、沈阳等）、回归前英属香港、美国（西雅图、纽约）、瑞士（日内瓦）、义大利、韩国、澳大利亚（雪梨）举行音乐会，担当指挥重任。	0.0
我不要红衣服，不过这件衣服不太红，将就着穿吧。	掌控江浙间书院。	0.0
不管荤的、素的都没个完。	荤素都上太多了。	1.0
要那种西瓜，沙瓤的。	服务业普遍奉行顾客至上的服务原则，但部份顾客会滥用权利，对服务员提出无理要求、投诉或于店内行为不检。	0.0
我才不干呢。	如TiO是最常用的光催化剂，它无毒、价廉、抗腐蚀并具有较高的催化活性。	0.0
他们厂上个月从欧洲购进了一批先进的设备。	使用者必须注册才能使用Facebook，注册后他们可以创建个人档案、将其他使用者加为好友、传递讯息，并在其他使用者更新个人档案时获得自动通知。	0.0
除了附表和说明，这篇文章不过两千五百字。	除了10辆全通编组（6M4T）外，增加了6辆（4M2T）和4辆（2M2T）编组方式，透过将各编组分离和结合，增加车辆运用效率。	0.0
他知道这事吗？当然知道，只不过他不说而已。	甲米地省有两个非常分明的季节：从11月到4月末是旱季，从5月到10月是雨季。	0.0
他乐坏了。	后来陈水扁又宣布台独，大搞烽火外交，变成激进台独，伤害台湾的国际外交；	0.0
忙的没个空儿。	从三原光向四分色转换。	0.0
物业公司要加强防火设施的维修和保养，以免再次发生报警误响的事件。	出于安全起见，事件后豪兹尔寄宿在市政府委员彼泊巴赫官邸，有两个警察昼夜监视。	0.0
我们班一半人住在三楼。	是中共第十一、十二、十三届中央委员，第十三届中央政治局委员、中央政治局常委。	0.0
其实我们的关系并没有公开。	在中国以外的地区，作为书面语被利用的古汉语文言文对没有文字的民族的语言的文字化带来了影响。	0.0
这次中国队派出的全是新人，为的是锻炼队伍。	索马里没有被证实有油藏，不过在脱离中央的邦特兰地区被认为可能有些油藏量，然而至今石油的探查结果仍然存有争议。	0.0
难道你有钱没地方花吗？	难道你钱多的没地方花吗？	1.0
他爸爸嘛，从早到晚都不沾家。	他爸爸从早到晚都不沾家。	1.0
小明在家务上给妈妈帮了不少忙。	米尔格若姆意识到，如果万有引力在星系外缘区域的变化是与半径的一次方成反比，而不是像牛顿的引力定律所预期的那样与半径的平方成反比，则这种不符或矛盾即可以得到解释。	0.0
他时刻不忘自己的职责。	两字母的航空公司代码表用于预约、时刻表、票务、征税、航空提单、公开发布的日程表和航空公司间的无线电通讯，同时也用于航线申请。	0.0
问个明白。	与此同时，在使用该新系统后，遇险的人员不论是按动紧急求救掣或是呼叫求救，控制室都能够凭著对讲机附有独一无二的编号，识别遇险人员的身份，从而增加支援效率。	0.0
轮番的轰炸后，这个美丽的小镇被夷为平地。	而这个金姓将领很有可能是汉武帝时代匈奴某王子的后裔。	0.0
玩了个痛快。	玩了个爽快。	1.0
他们家住了两个客人。	两个客人住在他们家。	1.0
吃饱了饭。	我把饭吃饱了。	1.0
有两只小鸡争着饮水，蹬翻了水碗，往青石板上一跳，满石板印着许多小小的“个”字。	因有两只小鸡争着饮水，蹬翻了水碗，往青石板上一跳，以至于满石板印着许多小小的“个”字。	1.0
他好像只通知了小王一个人。	估计他只通知了小王一个人。	1.0
由于工作的关系，我们在长沙逗留了几天。	黑社会需要在警察不干预的情况下才能够经营及谋取利益，故此警察和黑社会有一定程度的关系。	0.0
她离开广州已经好几年了。	好几年前她已经离开广州。	1.0
她讨了个没趣儿。	此后，撒纸赛跑会、天津草地网球会、天津妇女草地网球会、天津草地网球协会、天津浮水会、天津冰球会、天津垒球会、天津马球会、天津板球会、天津高尔夫球会、天津青年体育协会和天津业余无线电协会等运动协会相继在天津英租界成立。	0.0
我呢，一天到晚就爱看书。	我从早到晚就爱看书。	1.0
老李拿我们当小孩儿。	中华人民共和国成立后，实行三自政策，1993年信阳地区天主教两会成立于固始，管理境内天主教活动。	0.0
小心别碰着油漆。	经挑选的新学员会先于五月或七月在香港青年协会位于西贡大网仔的营地进行两日一夜的领袖训练营，并于稍后举行启动礼。	0.0
他没有吃饱。	他没吃饱。	1.0
墙上挂着齐白石的画。	乌古斯人是现在土库曼人的祖先。	0.0
她马上傲慢地环视了一下会场。	马上她傲慢地环视了一下会场。	1.0
句句都说到了我的心窝里。	建大校区由以前著名的建筑老八校之一的重庆建筑大学于2000年并入组成，位于沙坪坝区沙中路，与校本部A区一条马路相隔，有一地下隧道相连。	0.0
来客人的家庭。	目前，除了西埔里还保有农村景象外，其他的地方都已都市化。	0.0
这车进口的。	早在1928年12月15日，便有救世军在此用慈善锅发起募捐活动。	0.0
她发了个怔。	二是锅耳形，线条优美，变化大，实际上它是仿照古代的官帽形状修建的，取意前程远大，因它的形状像铁锅的耳朵，民间俗称镬（锅）耳墙。	0.0
举起手来！	林懋德罗马天主教主教。	0.0
那只凶恶的老虎被武松打死了。	由2008年7月1日开始，JR东日本通票使用者更可持通票免费乘搭北越急行全线、伊豆急行全线、东武铁道与JR东日本直通的特急列车，以及东武铁道下今市至东武日光或鬼怒川温泉的普通列车。	0.0
在桂花林里散步，别提多香了。	校址选定台北近郊北投之赛马场。	0.0
尽管他赢得了冠军，可是没有赢得人们的尊重。	虽说他赢得了冠军，但是没有赢得人们的尊重。	1.0
差点办成了。	没有办成。	1.0
小孙收入微薄，而且上有父母，下有子女，家庭负担不轻，但是，为人慷慨大方，经常帮助比他更困难的朋友。	"实数域R上的正交群O(""n""，R)和特殊正交群SO(""n""，R)在不会引起误会时经常记为O(""n"")和SO(""n"")。"	0.0
我想喊他等等我，却又怕他笑我胆小害怕，不叫他，我又真怕一个人摸不到那个包扎所，更怕一个人在那儿打吊瓶。	而建筑方面，初头系用一个简单嘅竹棚场地，后嚟喺1979年先至起咗栋两层楼嘅砖木结构建筑嚟办公。	0.0
女教官教我们如何在险恶多变的环境中战胜困难，最终完成任务。	他试图在加尔各答召开一次抗议集会，但最终决定放弃英国爵位以作为象征抗议的行动。	0.0
明智的人知道什么时候该糊涂。	在2003年7月，金亨稷先生诞辰110周年的时候建馆。	0.0
这个学生我教过他数学。	哈塔米在一些国际社团（其中最重要的是1998年在纽约的联合国大会上提出了他的理论的主要因素）中引入了他的理论后这个理论获得了许多国际支持。	0.0
老张家的房子厨房不大。	叶意深字曼卿，为中国清朝官员，浙江慈溪人。	0.0
出门在外没个不累的。	出门在外没有人不累。	1.0
烦死了！	不圆唇中央元音。	0.0
再给你我拿瓶啤酒！	柏勒洛丰，希腊神话中的英雄，他得到神的帮助捕获了天马珀伽索斯，并且打倒怪兽喀迈拉。	0.0
飞碟！	飞行物！	1.0
这位刘先生，他是个有钱人。	忽艨艟数十扬帆来，各立介士，甲光耀目，朱旗蔽天，相顾错愕。	0.0
我冲着他笑了笑，然后继续唱歌。	健康与社会工作。	0.0
我们没有不同意。	这些星系的红移都符合哈伯定律，表示它们和我们是相互在退行的，但它们在红移上的变化充分的显示出与有与上万个星系等效的质量被集中在那儿。	0.0
济南省城，那是大地方，不用说。	主要球场叫做中央球场，是举行决赛的地方。	0.0
两件共计五十元。	而行政人员则可透过AIP系统进行预算支出、公文追踪、业务审核等工作。	0.0
老李拿我们当小孩儿。	除了春节以外，在其他喜庆场合，例如婚礼、新店开张等亦有送红包的习惯。	0.0
既然那么高调参赛，他怎么会轻易退赛呢？	到第四圈，曼联面对英冠的昆士柏流浪，收起大部份主力。	0.0
丽丽哭红了眼睛。	例如，人工生命或虚拟进化试图通过简单（人工）生命形式的计算机模拟来理解进化过程。	0.0
你现在这样的成绩，说实话，很难拿到奖学金。	由于他名下所持的微软股份增值迅速，西蒙尼的身价自2005年超过了十亿美金，现在他在福布斯世界富豪榜上居第四百位左右。	0.0
那今晚我请你去看电影好了，只是不知道你的女朋友会不会介意。	那今晚我请你去看电影好了，只是得确定你的女朋友会不会介意。	0.8
他叫汽车撞倒了。	还有，网格通常比集群支持更多不同类型的计算机集合。	0.0
月儿在云中穿行，船儿在湖中荡漾，风儿拂面而来······。	船儿在湖中荡漾，风儿拂面而来，月儿在云中穿行。	1.0
护士态度很温和。	此次改良是应清政府宪政改革的需要，对栏目进行了调整，记载列为第一。	0.0
他有的是书。	在香港，摩根士丹利一向支持慈善基金爱心圣诞大行动（Operation Santa Claus）的筹款活动。	0.0
参加奥运会的运动员名单已经确定了。	已经确定了参加奥运会的运动员名单。	1.0
不死也脱层皮。	三个月后，黑胶唱片版本的加尔基 精液 栗子花于05月27日发行，当时因为Oricon将黑胶版和专辑两者的销售量合并计算，因此不得而知黑胶唱片的实际销售量。	0.0
什么事语法？简单的说，就是组词造句的规则。	乔治·罗米洛对艾格·莱特和赛门·培格的作品，因此邀请两人在他的电影-{zh-cn:僵尸之地；	0.0
年轻时我也漂亮过。	假设围住任意曲面 formula_104 的闭回路 formula_111 以常速度 formula_34 移动于磁场。	0.0
花猫逮住了一只耗子。	花猫抓住了一只耗子。	1.0
约翰偷了一辆自行车给玛丽。	爱因斯坦和普朗克为近代物理学的重要奠基者，维尔纳·海森堡及马克斯·玻恩并进一步发展。	0.0
局里派办公室王主任到现场做协调工作。	抵达陕北后，舒同任红四师政治部主任，参加直罗镇、山城堡等战役。	0.0
资金感到充足。	感觉资金充裕。	1.0
咱们开始吧！	随著副热带高压脊逐渐增强，黄蜂开始加快移动速度，同时华南及南海北部一带的气压梯度变得更大，当时香港各区风势开始明显增强。	0.0
杯子被他打破了。	不想说太多，但婚变事件于2011年5月底张柏芝的飞机合影事件而拉开序幕，由张栢芝率先打破沉默，力数谢霆锋的不是，更斥责他不要扮好男人。	0.0
他可能明天才会来。	输卵管手术也会导致异位妊娠，如常见的输卵管结扎术（或相反的，输卵管结扎后放开的手术），都有可能造成绒毛组织的损伤。	0.0
好不热闹。	不热闹。	1.0
刚一进门，我就发现今天的气氛不太一样。	赖森在史丹上发现了许多非致命性的伤口，包括数根断裂且愈合过的肋骨、一个断裂且愈合过的颈椎、脸颊处有愈合过的伤口、头后侧有个显目的缺口，直径约1公吋，大约是暴龙牙齿的大小。	0.0
打一次球累好几天。	如果水经过咖啡末只一次，成品中将主要包含易溶物质（包括咖啡因）。	0.0
他没看电影。	在电影逃学威龙2里，由吴孟达饰演的警官亦以曹达华作为角色的名称致敬。	0.0
她买了小王一件衣服。	这件衣服是从小王那儿买的。	1.0
他的数学不怎么好。	他的数学不好。	1.0
马上出发！	再次考虑集合的包含次序，一个集合已经严格小于另一个(可能无限的)集合，如果它包含的元素只少一个。	0.0
她的笑便渐渐少了。	"如果一个算法的时间 ""T""(""n"") 没有任何多项式上界，则称这个算法具有超越多项式时间。"	0.0
他走坏了一双鞋。	在研发过程中，两国的研制团队关系甚为密切，经常交换意见。	0.0
老兄！	而隶属台湾镇之下的此官职是台湾清治时期的这阶段，全台湾的海防军事层级最高武将，其统帅三标水营，数千名水师兵勇。	0.0
他说起话来没个完。	宾夕法尼亚级增加了主炮数量，采用四座三联装14英寸主炮的炮塔替换了内华达级的双联装主炮塔，使用12门14英寸口径火炮，相对同期日本的战列舰主炮布局，节约了重装甲防护面积。	0.0
他懒得去逛公园。	正壹法王。	0.0
这件事他办的成。	这件事是他办成的。	1.0
我们今天上中文课。	资产目录统计；	0.0
老实说我手头没有那本书。	而因为没有完整校舍，学校经常在湾仔各处战前唐楼的个别单位上课。	0.0
因获奖而成名。	因获奖而成名人。	1.0
他不比你强多少。	这类游戏以日本麻将居多，中文地区则多为网络麻将游戏。	0.0
他暧昧地瞅了小红一眼。	物理性质。	0.0
她唱歌不太难听。	刘纯一作刘醇，字宗厚，元明间吴陵人。	0.0
我能把这块大石头举起来。	在1896年有位德州联盟的选手Ollie Pickering，曾有连续七个打席都击出这种三不管地带的安打，所以前述的状况加起来，在1933年Baseball scrapbook一书就正式将这种安打球命名为Texas League single。	0.0
我深知老师的心理压力比我们还大。	年龄结构：	0.0
通过翻译，我们交谈了半个小时。	通过基督教文学的传播，教会团体所建立的学校，语音学和简单易学的谚文得到推广，使得人们识字率激增。	0.0
她学了两个钟头英语。	她英语学了两个钟头。	1.0
我没答应他。	敌稍退怯。	0.0
其实我们的关系并没有公开。	、我们都不住在原乡了。	0.0
小王被绊了一下，差点儿摔倒了。	以同样隶属于ARIA Entertainment的佐藤裕美开始，向茅原实里、水树奈奈、榊原由依、栗林美奈实、飞兰、NANA等多个歌手及音乐家提供乐曲。	0.0
这件事情她亲爸也没办法。	除新时代电视外，新时代传媒集团亦拥有加拿大中文电台以及普通话收费电视频道城市电视。	0.0
船几乎翻了底。	本来设定是讲述243年前的圣战的故事，但车田在第14回笔峰一转，转而跳到243年后转生为雅典娜的沙织与冥王激战后的时点，并且剧情涉及时空穿越以及天界篇的发展，令一直平实的故事情节突起波澜。	0.0
孙悟空本事再大，也逃不出如来佛的手掌。	孙悟空逃不出如来佛的手掌，不管他本事有多大。	1.0
这项任务得十个人。	同年五月，二张率师逆汉水而上，冲破元军重围，箭射伤蒙副帅刘整并于25日抵襄。	0.0
我是中大的学生，他是中大的老师。	拿破仑强迫奥地利割让弗里克谷，他打算用这个河谷来交换瓦莱州，此外他还建造道路通过瓦莱州的山口来保障法国在意大利北部的利益。	0.0
树上飞来一只鸟。	殖民和暴乱。	0.0
应该坚持实地的调查，免得被二手资料所蒙蔽。	应该坚持实地的调查，以防被二手资料所蒙蔽。	1.0
这位同学我没有跟他说过话。	该剧以抽象的概念死亡为题，没有具体的情节或环境，完全颠覆了传统的戏剧叙事风格。	0.0
我才不去呢。	另外PEAR（PHP Extension and Application Repository）也是类似CPAN的PHP程式网站。	0.0
到了广州，不能不夜游珠江。	珍妃的祖父裕泰曾任陕甘总督，父亲长叙曾任户部右侍郎，伯父长善曾任广州将军，珍妃与姐姐瑾妃自幼随长善在广州长大。	0.0
这道题好不容易呀，做了半天还没有做出来。	孟加拉野古草（学名：）是禾本科野古草属的植物。	0.0
轮番的轰炸后，这个美丽的小镇被夷为平地。	考试包括数学（文字题、计算机）和语文（阅读、逻辑推理、段落整理)能力测验。	0.0
你没有放下包袱。	但是，研究人员并没有反对二足方式移动的假设。	0.0
他打破了杯子。	宗旨与理念。	0.0
卖了一批设备给工厂。	，Ltd。	0.0
这个难题被技术部门及时攻克。	技术部门及时把这个难题攻克了。	1.0
我们就去帮他的忙。	虽然忽必烈在去世前有意以安南国王不肯来朝为口实，再度兴兵侵越，但刚好因他的去世而计划终止。	0.0
地震与海啸令这个国家的经济又倒退了十年。	地震与海啸使这个国家的经济又倒退了十年。	1.0
你们那儿的房子贵不贵呢？	你们那的房子贵不？	1.0
我冲着他笑了笑，然后继续唱歌。	望都战斗的交战双方，一方为国民革命军，另一方为北洋政府所辖军队。	0.0
父亲一句话也没有说。	这使得在拉里·布朗离队后，新教练也没有把布朗剔出正选。	0.0
风遇到防护林，速度就减少了百分之七十到八十。到了距离防护林等于林木高度二十米的地方，风速又恢复原来的强度。所以防护林必须是并行排列的许多林带，两列之间的距离不要超过林木高度的二十倍。	圣马力诺是世界杯资格赛最快入球的保持者，于1993年对英格兰赛事中，开赛后8。	0.0
我觉得佳艳的德语水平远在我之上，虽然我的考试成绩比他高。	虽说我的德语考试成绩比佳艳高。我却觉得他的水平远在我之上。	1.0
门前种着花。	广州工厂设在永和经济区，占地面积两万多平方米。	0.0
他什么都没个够！	到1970年代预科教育开始普及，不少学校都开始开设预科课程：	0.0
他们昨天去了北京。	会议结束后，北京猿人展览馆对展陈内容进行了重大调整，将综合研究的新成果充实到展览中，提高了展览的科学性和综合性。	0.0
他有的是钱。	像及安塞尔姆·基弗的作品就属于这一类。	0.0
帽子呢？	为彰显邓肇坚热心公益，英廷曾多次向他受勋。	0.0
这道题就算有点难度，也难不到哪儿去。	出土青铜器。	0.0
她的厨艺怎么样？	她做饭的水平怎么样？	1.0
看的很清楚。	马来西亚南洋商报编辑部负责人：	0.0
谁都知道事情的真相。	大约90%的灼伤发生在发展中国家，这是部分因为过度拥挤和不安全的烹饪条件。	0.0
兵兵回宿舍睡觉了。	兵兵回宿舍然后睡觉了。	1.0
哪儿他都去过。	联邦宪法法院经确认可宣告联邦总统丧失职权。	0.0
他逃脱不了法律的制裁，尽管他爸爸是李刚。	虽然他爸爸是李刚，然而他逃脱不了法律的制裁。	1.0
衣服难看死了。	根据世界概况，2010年全球石油平均日消耗量为约8700万桶。	0.0
我知道他不了解情况。	根据估计，对于这样一个能够将大统一理论和引力理论统一起来的万有理论，实验验证所需的能量将达到普朗克能量的量级：10百万电子伏特。	0.0
他的主意没个更改。	他的主意很坚定。	1.0
