text_a	text_b	score
快出村口时，回头再看一眼自己住了十多年的老屋，刘华生的心里一阵酸楚。	在复出后，新特兰在英超联表现表劲，笃定降级，但麦卡特尼开始找到自己的潜能。	0.0
老张家的房子厨房不大。	老张家的房子厨房很小。	0.6
书上写着名字。	锑在地壳中的丰度估计为百万分之0。	0.0
人人都知道这件事。	也是从911事件之后，朱利安尼获得了美国的市长这个称号，这一词似乎是由奥普拉·温芙瑞在2001年9月23日于洋基体育场举行的911纪念会上所创造的，从那之后这一称号便一直伴随朱利安尼至今。	0.0
他们家死了一盆花。	不过他们的成绩为法国即将卷起的文艺复兴之风奠定了坚实的基础。	0.0
有一种爱叫放手。	放手是一种爱的表现。	1.0
这瓶酒喝了我半个月的工资。	公路客运 岳阳市区主要汽车站为洞庭汽车站、岳阳客运站。	0.0
差点儿摔倒。	桦叶荚蒾（学名：）为五福花科荚蒾属的植物，为中国的特有植物。	0.0
他吃螃蟹吃病了。	第2周期元素 -	0.0
我国在这一方面的法律规定与贵国的法律规定相同。	为香港法律适用于港方口岸区的目的，港方口岸区视为位于香港以内的地域。	0.0
玩了个痛快。	"更进一步讲：""X""上的实向量丛的范畴是等价于O-模的局部自由和有限生成的层的。"	0.0
他说起话来没个完。	他说起话来没完没了。	1.0
倘若来不及逃跑，它就会使出装死的伎俩。	北海道犬与其他日本狗种一样，有专属的原产地域及传殖系统，由于牠是北海道厚真町的特产犬只，因此亦被称为厚真犬。	0.0
我们还没有拥有技术转让的权力。	与蝮蛇不同的是，它没有热窝：	0.0
我做题做了三个小时。	明朝治理运河，自南旺而北至梁山、张秋，与济水相交。	0.0
你应该协助我们完成这个项目。	常常违反游戏规则或是取得太多的负分数时，通常会被踢出伺服器外，还有，全球每个伺服器的管理人员通常会额外新增自订的战斗规则，来决定是否要赶走违反规则的玩家，假如违反规则的情事是可以被伺服器管理人员所接受的话（当管理人员在现场时），那么这个违反游戏规则的玩家就不会被踢出伺服器外，但是取得的负分数还是得照样计入等级与经验值内。	0.0
我两手空空，既不愿让悲鸿知道，以免他焦虑，又不愿开口向人求助。	当日未领取者于同年（第二阶段）2月7日至4月30日间可至通知单上之指定邮局领取，逾期不补发。	0.0
他吃烤鸭吃胖了。	由于她出生在吉打州有富裕和名望的阿拉伯裔家庭里，所以这桩婚事并没有受到吉打皇室的阻止。	0.0
他没去北京，去上海了。	故此，每次任务他越来越谨慎，为防意外降临自己身上，但一次进行任务时，突如其来遇上一个真正的交通事故，令其行动失败。	0.0
明天晴天。	游戏是采用单主线多分支模式，并且在部分关卡会出现隐藏关卡让玩家挑战难度。	0.0
2001年的白庙尚且如此贫穷，六年之前就更是可想而知了。	市内的情况越来越困难。	0.0
地球绕着太阳公转，同时又绕着他自己的地轴不停的自转。	亚斯坦对自己的歌唱能力是极端地谦逊，常常坚持自己不会唱歌。	0.0
这箱子轻不了。	这箱子不轻。	1.0
我用这把刀切肉。	安那瑞安有三名子女，两个不知名的女儿，和独子、继承人苏瑞安（Súrion）。	0.0
渐渐地，我们了解了他的脾气。	始于1999年，至2008年结束，预计为期十年，即平均每年有五个州要发行代表各自每一个州的硬币，希望借此让年轻一代了解各州的人文历史等传统文化。	0.0
这项任务得十个人。	乡校作为高丽官学的地方教育机构也在成宗时期得到普及。	0.0
大家都称他为小诸葛。	其后，经过几次变迁，大韩放送协会改组为韩国放送公社，成为大韩民国国营媒体。	0.0
我要一件衣服，这件衣服不太红，换红一点的。	没有神，人心就没有音乐。	0.0
不管我们如何好说歹说，他却仍然是无动于衷。	不论我们如何好说歹说，他却仍然是无动于衷。	1.0
他被老师批评了一顿。	公元十三世纪意大利旅行家马可·波罗将风筝传入欧洲。	0.0
不说不知道。	说了才知道。	1.0
丽丽哭红了眼睛。	另见：蒙古国的第一级行政区划单位	0.0
我们就去帮他的忙。	他们的家被抄，家里的东西都被砸碎。	0.0
他下楼了，在门口买了几个面包，塞在书包里，然后去了图书馆。	属名在拉丁文意为玩具的手指，因为这个新属具有牙齿、类似无齿翼龙的外表，类似典型的翼手龙玩具；	0.0
噢，我来这儿搞个采访。	警方登上启丰二号调查后，声称应海事处要求，要求罗堪就等人立刻返航往西湾河水警基地接受调查。	0.0
资金感到不足。	感到资金匮乏。	1.0
动物冬眠时，新陈代谢并未停止，只不过非常缓慢。	孟尼利克二世宣布进行全国总动员，并在阿杜瓦战役中打败了意大利入侵军。	0.0
桂花别提有多香。	全国可分为四个地带：	0.0
他们见了个面。	像超人类主义的生物学家就可能会抱持这样的心态，他们认为他们的工作在本质上是道德的，并且批评生命伦理学是在误导大众。	0.0
别把愁事憋在心里。	此公约与世界人权宣言的设立是在同一系列的事件。	0.0
当然是选择原谅她啊。	整除是数学中两个自然数之间的一种关系。	0.0
我不敢管你。	由于有上述这些问题，所有使用渐进扫描的新式显示设备都需要有去交错的功能。	0.0
不说不知道。	在美国总统选举中，内布拉斯加州是全美二个依据各候选人于各个国会议员选区的得票来分配选举人票，而非胜者全取的州（另一个是缅因州）之一。	0.0
她没有半点私心。	她大公无私。	0.8
在桂花林里散步，别提多香了。	为了和同在米兰的另一家足球俱乐部国际米兰区别，一般被称为AC米兰，或直接简称米兰。	0.0
眼睛看坏了。	甲醛对皮肤及黏膜有刺激性作用，比如咽喉和眼睛鼻腔等，造成这些位置水肿，发炎、溃烂，甚至最后导致鼻咽癌等严重病变。	0.0
他卖了我一只小狗。	有得克萨斯州立大学等高等学校多所。	0.0
这位刘先生，他是个有钱人。	这位刘先生是个有钱人。	1.0
丽丽哭红了眼睛。	丽丽把眼睛哭红了。	1.0
你不以我们的祖国有着这样的英雄而自豪吗？	其治所位于诺尔雪平，约有90，000位居民。	0.0
你果然准时到了。	西汉在此设置杨县。	0.0
这个没良心的。	使用这个法则，可以定义柯氏复杂性的互信息近似。	0.0
我给了她一只笔。	他的笔是我给的。	1.0
来北京之前，我一直呆在家里。	学校位于都柏林，总共有1500个学生。	0.0
留下了一点后遗症。	留下了许多后一症。	0.4
科学家正在努力探索这一奥秘，以便根据它的原理来研制新的导航仪器。	科学家正在努力探索这一奥秘，以便于根据它的原理来研制新的导航仪器。	1.0
现在半夜三更回家，也不用担心安全问题，。	抗战结束后国民政府将胶州公园改名为晋元公园。	0.0
她把这批马调教的很好。	，2015年中国电视剧，改编自温瑞安经典小说四大名捕。	0.0
这件事没有商量头儿，你们必须照办。	从此之后，两个人就再也没有见过面。	0.0
孙悟空本事再大，也逃不出如来佛的手掌。	极坐标系中的方程为：	0.0
我习惯喝咖啡不放糖。	使用情况。	0.0
整个小区的业主没有他不认识的。	整个小区的业主他都认识。	1.0
他的衣服干干净净的。	半岛的塔多用唐风，善用石料，由台基、朴素的基座、塔身、平头的塔顶座和坐落其上的塔刹构成，塔顶上的平头基座是朝鲜塔的特点，此外韩式塔的塔檐不用斗拱而用叠涩出檐的形式，这更加适合石料本身的力学特征。	0.0
教室里跑出一群孩子。	佛、老、儒三教发展。	0.0
他喝穷了一家子。	一家子都被它喝穷了。	1.0
他可能明天才会来。	可能明天他才会来。	1.0
大家热烈鼓掌表示庆贺。	此表示式不需要指数函数，所以适用于指数函数无每一处定义域，如p进数域。	0.0
他下午也许来不了。	英语原称Irrawaddy，现称Ayeyarwady），简称伊江，缅甸第一大河，长2，288公里，流域面积420，934平方公里。	0.0
说实在的，我不喜欢那种款式的衣服。	清教徒革命后剧院往往不喜欢这部作品中虚无主义的味道，因此一般在上演时对它改编。	0.0
你应该协助我们完成这个项目。	到秋天工作完成就领取最后一份工资。	0.0
我给了她一只笔。	她从我这拿了一支笔。	1.0
咱俩谁跟谁呀。	我们不分彼此。	1.0
谁都知道事情的真相。	至于法国军方是否要将已经服役的RBE2雷达加以更换，需要根据国防预算的编列而定。	0.0
你陪我去趟佛山吧。	极轨卫星运载火箭。	0.0
明天下雨的话，活动就会泡汤。	如果明天下雨的话，活动便会泡汤。	1.0
关山月，广东阳江人。	此外，也有双手都能够顺利运用的动作。	0.0
没你这么干的。	今年新造的蒸汽机中还包含了一个小的涡轮机，从汽缸中出来的蒸汽还可以利用它的余热在推动这个涡轮机来提高整个驱动装置的效率。	0.0
差点儿闹笑话。	险些闹笑话。	1.0
这箱子轻不了。	夜鹭是一种很聪明的鸟类，会用{鱼饵} 钓鱼 。	0.0
花猫逮住了一只耗子。	后世称带着知性温柔，蕴藏着温柔知性，未给人感觉夸大。	0.0
他没有听懂。	暂时性任务可以包括在罗马的一座宗座大学（Pontifical University）学习以获得高级学位。	0.0
这个计划没有一点问题。	然而，这个理论在激进政治经济学家那里获得保存和讨论。	0.0
他买了王教授一本书。	在治校理念上，确立了民主治校原则，也称为教授治校，清华的教授会、评议会、校务会以及各种专门委员会，多由教授担任，让教授能积极参与学校事务。	0.0
没你这么问的。	是中国第一位经民主推举产生的大学校长。	0.0
由于对造成事故的主观原因认识不足，因此导致了此类事故的再次发生。	拉米雷斯在2006赛季中超联赛中出场27次，打进13球，是当赛季上海申花队的最佳射手，但申花队认为拉米雷斯速度和比赛节奏太慢，并因此放弃与拉米雷斯续约。	0.0
他没有吃饱。	）几乎没有此类司铎要求并获得豁免当前的规定；	0.0
他让我们笑疼了肚子。	商鞅逃亡途中因未携带身份证件而不能投宿旅店，转而逃至魏国。	0.0
不管你说什么，他总是听不进去。	随著观塘线延线通车，车站指南根据旧版本再度更改设计，更改日期显示的方法。	0.0
他们永远不会得到受害国的原谅，如果他们不真心悔过并道歉的话。	如果个人PK (队长对战或人与动物比赛）挑战失败，要履行自定惩罚。	0.0
恨不得把一分钱掰成两半花。	成立于1830年。	0.0
由于工作的关系，我们在长沙逗留了几天。	我们在长沙逗留了几天，由于工作的关系。	1.0
衣服被火星烧出一个洞。	安条克的圣依纳爵，也称作神的使役（Theophorus），），为使徒后时代（Post-Apostolic Age）的基督徒领袖之一，第一个称基督教会为大公教会者，相传曾接受使徒约翰直接的教导，正教会第三位安条克牧首（前两位分别是圣伯多禄与埃伏第乌斯）。	0.0
不管你说什么，他总是听不进去。	三氧化碳（CO）是一种不稳定的碳氧化合物。	0.0
他拒绝回答这个问题。	圣经的出版延误是会出现的，在于它须要移除错误、或则为了校正教义问题在解答上的逻辑性而作的一些搜查、或则为了获得正确的翻译。	0.0
你们拿了人家不少好处。	另外，由于中国大陆协助戒除赌瘾的组织不足，使假冒六合彩于不少地区造成严重的社会问题。	0.0
唱了又唱。	不同的海洋哺乳动物由不同的祖先进化而来。	0.0
这些东西可能被雨弄湿了。	原住民部族于1763年发起的庞蒂亚克战争（Pontiac's Rebellion）便是试图阻止英国占领这些法国属土的起义。	0.0
他连个规矩都没有。	后年，西班牙政府与英国政府签定停战协定，摩根缺乏了英国在背后的支持，被带到了伦敦受审，不过由于过去摩根一直协助英国牵制西班牙，英国政府并没有重判摩根，反而在数年后封他爵士爵位，并任他为英国驻牙买加的总督。	0.0
你知道个屁！	根据古兰经第2章275节，真主准许买卖，而禁止利息，知道此教义而再犯的人是火狱的居民，他们将永居其中。	0.0
广交会一年两次。	第五舰队总司令：雷蒙德·斯普鲁恩斯海军中将 旗舰：印第安那波利号重巡洋舰(CA-35) 下辖第51特遣舰队(TF-51)、第58特遣舰队(TF-58)	0.0
杯子里面的水。	随后，韩德勤又与彭雪枫部、黄克诚部发生摩擦冲突。	0.0
她离开广州已经好几年了。	而两名中场球星分别来自巴拉圭，最近参与2006年世界杯的和来自波兰。	0.0
因为时间太仓促了，他们放弃了这次参赛的机会。	因时间太仓促了，他们放弃了这次参赛的机会。	1.0
你们拿了人家不少好处。	坚忍不拔、吃苦耐劳、热情好客、自由自在、无拘无束，是贝都因人的个性特征。	0.0
他问我会议什么时候结束。	在二战结束，集中营的囚犯被解放之后，很多被归类为粉红色三角形的囚犯在盟军建立的德意志联邦共和国中再度被囚禁。	0.0
每次出差回来都给她带礼物，要不然就一定给你脸子看。	它衡量多空双方创出的峰值（最高价）距每天收市价的距离与一定时间内（如7天、14天、28天等）的股价波动范围的比例，以提供出股市趋势反转的讯号。	0.0
地球绕着太阳公转，同时又绕着他自己的地轴不停的自转。	地球一边绕着太阳公转，一边绕着他自己的地轴不停的自转。	1.0
小王被领导批评了。	他所孜孜以求的，是眼睛和对象之间，对象和读者之间直接相通，产生光鲜如画的感觉，为了达到这个目的，他砍掉了整个森林的冗言赘词，他还原了基本枝干的清爽面目，他删除了解释、探讨，甚至于议论，砍掉了一切花花绿绿的比喻，清除了毫无生气的文章俗套，直到最后，通过疏疏落落、千锤百炼的文字，眼前豁然开朗，能有所见。	0.0
是谁昨天用钳子把车修好的。	全年皆可繁殖，每胎5－12只。	0.0
一旦有机会，就要全力以赴。	一旦机会来了，就要全力以赴。	1.0
他拿了我一本书。	商代，山西是商的主要统治区。	0.0
他们家平常不外出旅游。	他们当中不少人都在石硖尾一带自行兴建木屋，作为容身之所。	0.0
他犯了一点错误。	他犯了一些错误。	1.0
我和老李一起完成了任务。	尤善设机巧，引人入彀，不惮反复，说理详尽。	0.0
这辆车被水淹过。	兴建之前，将被水淹地带的民居和古迹需要被移到其他地方。	0.0
我们班一半人住在三楼。	三楼，我们班的一半人住在那儿。	1.0
他的瘤子还不太大。	，他的一位同事忽视了这一警告，指挥德军第20空军野战师的威廉·克里佐利准将返回军指挥部开会时，被游击队抓获和杀害。	0.0
主席团没在台上坐着。	国立台北商业大学	0.0
这台电脑修了我五百块钱。	自然哲学的数学原理被认为是科学史上最重要的论著之一。	0.0
这道题就算有点难度，也难不到哪儿去。	这些计算模型包括	0.0
来的人很多，会场一会儿就坐满了。	来的人不多，会场没坐满。	0.0
忙得我团团转。	诗经是陆续编辑成的，最古的是周颂，接著是大雅，其次是小雅，最晚的是商颂、鲁颂和国风。	0.0
他已经通知了所有人。	，日本杂事诗：玉墙旧国纪维新，万法随风倏转轮。	0.0
在下次董事会上，一定得拿出个让大家都满意的新方案出来。	在下次董事会上，一定要把让大家都满意的新方案拿出来。	1.0
把纸撕碎。	长征可以指:	0.0
倘若来不及逃跑，它就会使出装死的伎俩。	假使来不及逃跑，它便会使出装死的伎俩。	1.0
你不以我们的祖国有着这样的英雄而自豪吗？	我们确认，民族语的困难永远会是很多学习者的障碍，然而他们也会因第二语言的知识而获益。	0.0
他拿了王教授一本书。	她的工作终于由数学教授多丽丝·沙特施奈德(Doris Schattschneider)检验。	0.0
她傲慢地环视了一下会场。	傲慢的她傲慢地环视了一下会场。	1.0
他们家跑了一条狗。	他们的实验使用了1。	0.0
最近，妈妈一直被失眠所困扰。	在马英九、洪秀柱、连战、吴伯雄、朱立伦先后上台发言后，经过有关表决方式的争论，临时全国代表大会以举手方式，812票通过废止提名洪秀柱担任中国国民党籍总统候选人提案，并鼓掌通过征召中国国民党主席朱立伦为参选人。	0.0
这台电脑修了我五百块钱。	出现了拜占庭使用这个符号的含义的混乱；	0.0
他有两个儿子，一个是记者，一个是公务员。	一开始，调查人员在机场跑道发现了一个燃料缸的盖子，怀疑它就是空难的元凶。	0.0
年轻人不喜欢读书。	沮渠牧犍却更加讨厌拓跋王后，更喜欢李氏。	0.0
再折腾也没用。	与都营浅草线连接的泉岳寺站和高架的品川站之间路段分别出现下行线33‰、上行线38‰的陡坡，在品川站以南则要通过一个速度限制25km/h，半径100m的左转急弯且同时在JR各线上方穿过，然后北品川站附近开始进入最高行车速度为120km/h的高架路段。	0.0
他时刻不忘自己的职责。	他于一八三零年自己十九岁出版了一本诗集。	0.0
差点办成了。	冷战时期的小说四月早晨（1961年）将列星顿之战改编为小说，并被美国的中学用为读本。	0.0
揍你个生活不能自理。	不久，英国从清政府手中获得了海关管理权。	0.0
那马猛然一惊，直立起来。	渤海国及其继承的高句丽不是汉族史，祚荣骁勇善用兵，靺鞨之众及高丽余烬，稍稍归之。	0.0
三班的跟我走！	经朝廷查核，纯属诬枉，宋神宗两次降诏安慰欧阳修，贬之奇监道州酒税。	0.0
姐姐昨天就把这消息告诉我了。	美国有史以来最昂贵的选举。	0.0
王军他如何也在这里？	泗阳历史悠久，具有5000多年的文明史、2000多年的建县史，南北文化在这里融合，西汉时期曾两度封王，是两千多年前西汉泗水国都邑，史称泗水国，前后历时134年。	0.0
它的宽大的叶子也是片片向上，几乎没有斜生的，更不用说倒垂了。	随后，没有选择与北京国安队续约，转投韩国K联赛全北现代队，并将为该队效力两年。	0.0
干一行爱一行。	对于这一看似矛盾之处，暴胀理论给出了解决方案，它指出在宇宙诞生极早期（早于重子数产生）的一段时间内，宇宙被均匀且各向同性的能量标量场主导着。	0.0
他没有告诉我火车晚点了。	没有科学研究足以证明改变性倾向的治疗是安全或有效的，事实上，对于同性恋者或双性恋者，这些治疗通常带来负面影响或心理阴影。	0.0
我给了她一只笔。	他的一只笔是我给的。	1.0
差点办成了。	险些办成了。	1.0
对手被我们打败。	我们若假设太阳向外传送的能量在每个方向上都是相等的，那就只要知道以太阳为中心，地日距离为半径的球壳面积有多大，将太阳常数乘以这个数值就能得到太阳的光度了。	0.0
演讲比赛谁报名了？	车站西口东附近有峰巴士停。	0.0
躺在床上翻来覆去，睡不着。	寛永八年（1631年）5月，由于忠长出现乱行（斩杀多人，其中一人为家臣），而被命令蛰居甲府。	0.0
干一行爱一行。	与同样是藤田和日郎的弟子（助手），魔力女管家的原作者中山文十郎（旧笔名城池胜幸）是同行老友。	0.0
他走坏了一双鞋。	随后，1712年，汤玛斯·纽科门也发明了一种蒸汽机。	0.0
我会是坏人吗？	此外，美国在亚洲战略的态度上多少也影响到台湾人的反日情绪，主因在于中华民国政府迁台后，国际间的冷战局势，美国希望联同日本牵制共产阵营在亚洲地区的扩张，也曾试图将台湾纳入防御体系以联结东亚的反共阵线，故在战略考量上必须和日本同一阵线；	0.0
石头上刻着诗歌。	有叛燕军人就因而向北魏报告慕容垂已死的消息，拓跋珪想去追击，但知平城陷落后就打消念头。	0.0
我昨天写好了一封信。	昨天我写了一份信。	1.0
她讨了个没趣儿。	球员名单。	0.0
因为闹了一点小矛盾，彼此就不再来往了。	由于双方各有千秋，彼此并驾齐驱，粤剧历史上称为薛马争雄时期。	0.0
他卖了我一只小狗。	斯各特和杰姆的母亲在他们记事之前就离开了，梅薏拉的母亲去世了，拉德力夫人对布的幽闭保持沉默。	0.0
我们用筷子吃西餐。	我们吃西餐用筷子。	1.0
田先生毛笔字写的好。	岂独程朱大贤，立身制行卓绝，陆王亦大贤，立身制行卓绝；	0.0
你没有放下包袱。	包袱你没放下。	1.0
钢笔写坏了。	地球的科技几乎无法对超人造成伤害，但从魔法的观点来看超人也不过只是个正常人。	0.0
虽然是满月，天上却有一层淡淡的云，所以不能朗照；但我以为这恰是到了好处——酣眠固不可少，小睡也别有风味。	虽说是满月，因为天上有一层淡淡的云，所以不能朗照；然而我以为这恰是到了好处——酣眠固不可少，小睡也别有风味。	1.0
为这件事，我们都很高兴。	随著屯门区近郊发展迅速，由香港黄金海岸至三圣一段青山公路正计划进行第二次扩建工程，以应付日后需求。	0.0
我请他来。	直到2015年4月24日，已有超过100万封电子邮件寄给TRAI，要求网路中立性。	0.0
这本书我恰好看过。	重建后的校园设有以下的新设的设施（部分）：	0.0
唯有加深了解，才能相互信任与合作。	除非加深了解，否则不可能相互信任与合作。	1.0
差点儿答不上来。	在国际地理信息标准中，国家地区代码通常是2至3码，为资料库查表求找国家全名等资料的依据。。	0.0
我知道他不了解情况。	我不知道他不了解情况。	0.0
因为一点小矛盾，彼此就不再来往了。	较往年不同的是，以往环台赛仅有七站，因为配合台北世界贸易中心南港展览馆（下简称南港馆）随著台北国际自行车展（下简称自行车展）于3月13日开幕，并正式启用的关系，使得2008年的比赛，除了新增南港馆的分站外，更创下一连两天在台北市进行不同场地绕圈赛的首例，也让环台赛在2008年的规模，提升至八站。	0.0
这两个问题不同。	但由于缺少家庭关系，西塞罗只能有两个途径进入政治：从军或是从法。	0.0
除了附表和说明，这篇文章不过两千五百字。	平将门的名誉平反是在江户幕府时期的三代将军德川家光的时代，由于乌丸光广听闻了将门传说的始末之后，向朝廷申请了赦免，才得以去除了国贼这个污名。	0.0
你去办公室打电话叫快餐店送十二份盒饭来。	不过在美国偏乡地区校园内，这样的人依然显著地被排挤。	0.0
他走过去。他倒了一杯酒。他喝了一口。	校内体制。	0.0
不死也脱层皮。	身高177cm。	0.0
他曾经长期不上班。	英祖戊寅年(1758年)时获赐谥号忠翼 ；	0.0
美死了！	胜者打冠军战，败者打季军战。	0.0
恨不得把一分钱掰成两半花。	一分钱被掰成两半花。	0.8
老陈换了个姿势继续说。	世界足坛最佳阿根廷巨星之一。	0.0
他没往家里寄过半分钱。	闻名全球的富士山是日本重要的象征之一，被视为圣山，其在古代文献中亦被称为不二、不尽或是富慈，也经常被称作芙蓉峰或富岳。	0.0
这本书不是我的。	位于牛肉岛的泰伦斯·B·利尔森国际机场（IATA代码：EIS）为罗德城的服务机场，该机场也是群岛里面唯一的一个主要机场。	0.0
他们家住了两个客人。	然而，因为在二战期间忙于军事有关的研究，他们直到1947年都没有公布他们的发现。	0.0
出门在外没个不累的。	人出门在外都很累。	1.0
我一定把驾驶执照考下来，只要你给我时间。	如果你给我时间，我一定把驾驶执照考下来。	1.0
他问我会议什么时候结束。	由图哈切夫斯基率领的红军在与波兰军进行了几轮拉锯战之后，苏军在华沙战役中被对方击退，双方于1921年3月18日签订里加条约结束战争。	0.0
